Column1.1,Column1.2,Column1.3,Column1.4,Column1.5
1, Fitness Enthusiasts, Consumers using fitness tracking apps and websites.,26-05-2016 14:57,23-05-2018 11:30
2, Gamers, Consumers researching game reviews and cheat codes.,26-05-2016 14:57,23-05-2018 11:30
3, Car Enthusiasts, Readers of automotive news and car reviews.,26-05-2016 14:57,23-05-2018 11:30
4, Luxury Retail Researchers, Consumers researching luxury product reviews and gift ideas.,26-05-2016 14:57,23-05-2018 11:30
5, Brides & Wedding Planners, People researching wedding ideas and vendors.,26-05-2016 14:57,23-05-2018 11:30
6, Vacation Planners, Consumers reading reviews of vacation destinations and accommodations.,26-05-2016 14:57,23-05-2018 11:30
7, Motorcycle Enthusiasts, Readers of motorcycle news and reviews.,26-05-2016 14:57,23-05-2018 11:30
8, Business News Readers, Readers of online business news content.,26-05-2016 14:57,23-05-2018 11:30
12, Thrift Store Shoppers, Consumers shopping online for clothing at thrift stores and researching locations.,26-05-2016 14:57,16-03-2018 13:14
13, Advertising Professionals, People who read advertising industry news.,26-05-2016 14:57,23-05-2018 11:30
14, NFL Fans, People reading articles and websites about football and the NFL.,26-05-2016 14:57,23-05-2018 11:30
15, NBA Fans, People reading articles and websites about basketball and the NBA.,26-05-2016 14:57,23-05-2018 11:30
16, NCAA Fans, People reading articles and websites about college sports and the NCAA.,26-05-2016 14:57,23-05-2018 11:30
17, MLB Fans, People reading articles and websites about baseball and the MLB.,26-05-2016 14:57,23-05-2018 11:30
18, Nascar Fans, People reading articles and websites about nascar.,26-05-2016 14:57,23-05-2018 11:30
19, Eco-Conscious Consumers, People researching climate change and sustainable living.,26-05-2016 14:57,23-05-2018 11:30
20, Moviegoers, Consumers researching box office listings and buying movie tickets.,26-05-2016 14:57,23-05-2018 11:30
21, DIYers, Consumers researching DIY projects.,26-05-2016 14:57,23-05-2018 11:30
22, Grill Masters, Grill owners researching new recipes.,26-05-2016 14:57,23-05-2018 11:30
23, Techies, Readers of tech news and gadget reviews.,26-05-2016 14:57,23-05-2018 11:30
24, Home Design Enthusiasts, Consumers researching home design styles and trends.,26-05-2016 14:57,23-05-2018 11:30
25, Doctors, People reading medical journals and using online prescribing services.,26-05-2016 14:57,23-05-2018 11:30
26, Streaming Video Fans, Consumers streaming feature length movies and TV shows.,26-05-2016 14:57,23-05-2018 11:30
27, Auto Insurance Shoppers, Consumers shopping for auto insurance.,26-05-2016 14:57,23-05-2018 11:30
28, Teachers, People reading education industry publications and teaching advice websites.,26-05-2016 14:57,23-05-2018 11:30
29, College Students, People visiting university websites.,26-05-2016 14:57,23-05-2018 11:30
30, Department Store Shoppers, Consumes shopping at multi-category department stores.,26-05-2016 14:57,23-05-2018 11:30
31, Home Decor Shoppers," Consumers shopping for home design, art and accessories.",26-05-2016 14:57,23-05-2018 11:30
33, Kids Clothing Shoppers, Consumers shopping for childrens apparel.,26-05-2016 14:57,23-05-2018 11:30
34, Teen Girl Clothing Shoppers, Consumers in-market for clothing for teenage girls.,26-05-2016 14:57,23-05-2018 11:30
35, Mens Clothing Shoppers, Consumers in-market for mens clothing.,26-05-2016 14:57,23-05-2018 11:30
36, Baby Products Buyers, Consumers shopping for baby-related products.,26-05-2016 14:57,23-05-2018 11:30
37, Jewelry & Watch Shoppers, Consumers researching high-end watch and jewelry brands.,26-05-2016 14:57,23-05-2018 11:30
38, Sporting Goods Shoppers, Consumers shopping for sporting goods and activewear apparel.,26-05-2016 14:57,23-05-2018 11:30
39, Furniture Shoppers, Consumers shopping for major home furnishings.,26-05-2016 14:57,23-05-2018 11:30
40, Bed & Bath Shoppers, Consumers shopping for bed and bath products.,26-05-2016 14:57,23-05-2018 11:30
41, Intimates Shoppers, Consumers shopping for lingerie.,26-05-2016 14:57,23-05-2018 11:30
42, Fast Fashion Shoppers, Consumers shopping for apparel that mimics current runway trends.,26-05-2016 14:57,23-05-2018 11:30
43, Apartment Hunters, People reading real estate rental listings.,26-05-2016 14:57,23-05-2018 11:30
44, Home Buyers, People reading real estate sales listings.,26-05-2016 14:57,23-05-2018 11:30
45, Moving Services Shoppers, Consumers who are shopping for moving services.,26-05-2016 14:57,23-05-2018 11:30
46, Job Seekers, People researching job boards.,26-05-2016 14:57,23-05-2018 11:30
48, Charitable Donors, People researching major charitable organizations.,26-05-2016 14:57,23-05-2018 11:30
49, NHL Fans, People reading articles and websites about hockey and the NHL.,26-05-2016 14:57,23-05-2018 11:30
50, Discount Big Box Shoppers, Consumers shopping at big box retailers.,26-05-2016 14:57,23-05-2018 11:30
51, Black Friday Deal Shoppers, Consumers researching holiday sales events.,26-05-2016 14:57,23-05-2018 11:30
53, Hip Hop Fans, People reading about hip hop music and hip hop stars.,26-05-2016 14:57,23-05-2018 11:30
54, Online Investors, Consumers with an active online trading account.,26-05-2016 14:57,23-05-2018 11:30
55, Seasonal Allergy Sufferers, People researching allergy trends and treatment options.,26-05-2016 14:57,23-05-2018 11:30
56, Discount Device Shoppers, Consumers shopping for discounted electronics.,26-05-2016 14:57,23-05-2018 11:30
57, Mobile Phone Comparison Shoppers, Consumers researching alternative mobile phones and wireless plans.,26-05-2016 14:57,23-05-2018 11:30
58, Budget Wireless Shoppers, Consumers researching discount wireless service plans.,26-05-2016 14:57,23-05-2018 11:30
59, Menopause Researchers, People researching menopause symptoms.,26-05-2016 14:57,23-05-2018 11:30
60, Online Health Researchers, People researching general health questions.,26-05-2016 14:57,23-05-2018 11:30
61, Beauty & Skincare Buyers, Consumers shopping for beauty and skincare products.,26-05-2016 14:57,23-05-2018 11:30
62, Streaming Device Shoppers, Consumers shopping for connected TV products.,26-05-2016 14:57,23-05-2018 11:30
63, New & Expecting Parents, People researching pregnancy issues and baby names.,26-05-2016 14:57,23-05-2018 11:30
64, High-End Kids Furniture and Clothes Shoppers, People shopping at high end childrens clothing and toy retailers.,26-05-2016 14:57,23-05-2018 11:30
65, Hands-On Parents," People reading about family cooking, parenting advice and childrens activities.",26-05-2016 14:57,23-05-2018 11:30
66, Fantasy & Comic Fans, Consumers of online comics and fantasy novels.,26-05-2016 14:57,23-05-2018 11:30
67, Lawyers, People reading legal journals and industry publications.,26-05-2016 14:57,23-05-2018 11:30
69, Healthy Eaters, People researching healthy eating options.,26-05-2016 14:57,23-05-2018 11:30
70, Drug Store Shoppers, Consumers shopping online or searching for a local drug store.,26-05-2016 14:57,23-05-2018 11:30
71, Lawn & Garden Enthusiasts, Consumers reseraching lawn and garden maintenance techniques.,26-05-2016 14:57,23-05-2018 11:30
72, Nurses, People reading websites about nursing lifestyle and career advice.,26-05-2016 14:57,23-05-2018 11:30
73, Mailing & Shipping Shoppers, Consumers shopping for shipping supplies and postage.,26-05-2016 14:57,23-05-2018 11:30
74, Office Supply Shoppers, Individuals in-market for office supplies.,26-05-2016 14:57,23-05-2018 11:30
75, Ink & Toner Shoppers, Consumers shopping for printer ink.,26-05-2016 14:57,23-05-2018 11:30
77, Luxury Retail Shoppers, Consumers shopping for high end fashion apparel and accessories.,26-05-2016 14:57,23-05-2018 11:30
78, Contractors & Construction Professionals, People reading contractor trade publications.,26-05-2016 14:57,23-05-2018 11:30
79, Luxury Travel Researchers, Consumers reading online reviews of luxury travel options.,26-05-2016 14:57,23-05-2018 11:30
80, Democrats, People reading Democratic party advocacy websites.,26-05-2016 14:57,23-05-2018 11:30
81, Republicans, People reading Republican party advocacy websites.,26-05-2016 14:57,23-05-2018 11:30
82, HDTV Researchers, Consumers shopping for a new TV.,26-05-2016 14:57,23-05-2018 11:30
83, Hardware Shoppers, Consumers shopping at hardware and home supply stores.,26-05-2016 14:57,23-05-2018 11:30
84, Reggaeton Fans, People reading about reggaeton music and culture.,26-05-2016 14:57,23-05-2018 11:30
85, Online Movie Downloaders, Consumers downloading feature length movies and TV shows.,26-05-2016 14:57,23-05-2018 11:30
86, Sale Seekers, Consumers researching sales events and special offers.,26-05-2016 14:57,23-05-2018 11:30
87, Theme Park Researchers, Consumers reading online reviews of theme parks and accommodations.,26-05-2016 14:57,23-05-2018 11:30
88, Ski and Snowboard Enthusiasts, Consumers reading reviews of ski resorts and snow reports.,26-05-2016 14:57,16-01-2019 09:11
89, Travel Researchers, Consumers reading reviews of travel destinations.,26-05-2016 14:57,23-05-2018 11:30
90, Coupon Researchers, Consumers researching sales and discount codes.,26-05-2016 14:57,23-05-2018 11:30
91, Parents with Toddlers, People shopping for infant and toddler supplies.,26-05-2016 14:57,23-05-2018 11:30
92, Parents with Kids, People reading about activities for young children.,26-05-2016 14:57,23-05-2018 11:30
93, Young Boomers, People researching sending children to college.,26-05-2016 14:57,23-05-2018 11:30
94, Day Care Users, People researching daycare options.,26-05-2016 14:57,23-05-2018 11:30
95, Stay-at-Home Parents, People reading about child raising advice and activities.,26-05-2016 14:57,23-05-2018 11:30
96, Exercise and Gym Researchers, People researching gyms and health clubs.,26-05-2016 14:57,23-05-2018 11:30
97, Home Kitchen Chefs, Consumers researching recipes.,26-05-2016 14:57,23-05-2018 11:30
98, Restaurant Researchers, Consumers researching local restaurant reviews.,26-05-2016 14:57,23-05-2018 11:30
99, Order-in Eaters, Consumers who order food delivery.,26-05-2016 14:57,23-05-2018 11:30
100, Nutrition Conscious Eaters, Consumer reading about healthy eating options.,26-05-2016 14:57,23-05-2018 11:30
101, Flower & Gift Basket Shoppers, Consumers shopping for flowers and gift baskets.,26-05-2016 14:57,23-05-2018 11:30
102, Plus Size Women, Consumers shopping for plus size womens apparel.,26-05-2016 14:57,23-05-2018 11:30
103, Live Concert Fans, Consumers researching live concerts and music festivals.,26-05-2016 14:57,23-05-2018 11:30
104, Country Music Fans, People reading about country music and country music stars.,26-05-2016 14:57,23-05-2018 11:30
106, Comedy Fans, Consumers of online comedy videos and articles.,26-05-2016 14:57,23-05-2018 11:30
107, Cruise Travel Intenders, Consumers visiting cruise comparison and planning sites.,26-05-2016 14:57,23-05-2018 11:30
108, Pain Medication Users, People researching pain medication options.,26-05-2016 14:57,23-05-2018 11:30
109, Joint Pain Sufferers, People researching joint pain treatment options.,26-05-2016 14:57,23-05-2018 11:30
110, Pain Management Researchers, People researching chronic pain treatment options.,26-05-2016 14:57,23-05-2018 11:30
111, Retirement Planners, People researching retirement living options.,26-05-2016 14:57,23-05-2018 11:30
112, Auto Repair Researchers, Drivers researching how to maintain their cars.,26-05-2016 14:57,23-05-2018 11:30
113, Avid Readers, Readers researching books and long form journalism.,26-05-2016 14:57,23-05-2018 11:30
114, Womens Fashion Magazine Readers, Consumers researching trending womens apparel.,26-05-2016 14:57,23-05-2018 11:30
115, Mens Shoe Shoppers, Consumers in-market for mens shoes.,26-05-2016 14:57,23-05-2018 11:30
116, Home Security Shoppers, Consumers shopping for a home security system.,26-05-2016 14:57,23-05-2018 11:30
117, Boxing Fans, People reading articles and websites about the sport of boxing.,26-05-2016 14:57,23-05-2018 11:30
118, Sleep Disorder Researchers, People researching sleep loss disorders and treatment options.,26-05-2016 14:57,23-05-2018 11:30
119, Mortgage Researchers, People comparing mortgage offers.,26-05-2016 14:57,23-05-2018 11:30
121, Coders & Developers, People reading about software development techniques and products.,26-05-2016 14:57,23-05-2018 11:30
123, Military Servicemembers & Veterans, People visiting websites about military benefits.,26-05-2016 14:57,23-05-2018 11:30
124, Healthcare Discount Shoppers, Consumers researching discounted and tax-free drug offers.,26-05-2016 14:57,23-05-2018 11:30
125, Postal Employees, People buying postal employee uniforms and equipment,26-05-2016 14:57,28-10-2016 15:50
126, Soccer Fans, People who love visiting websites and reading about soccer.,26-05-2016 14:57,23-05-2018 11:30
128, Kitchen & Bathroom Remodelers, Consumers researching kitchen and bath design.,26-05-2016 14:57,23-05-2018 11:30
129, Aftermarket Accessories Shoppers, Consumers shopping for car maintenance products.,26-05-2016 14:57,23-05-2018 11:30
130, Automotive Safety Researchers, Consumers researching car safety ratings.,26-05-2016 14:57,23-05-2018 11:30
131, Android Fans, Readers of Android news and product reviews.,26-05-2016 14:57,23-05-2018 11:30
132, Apple Fans, Readers of Apple news and product reviews.,26-05-2016 14:57,23-05-2018 11:30
133, High End Camera Shoppers - Dupe, Consumers shopping for high end cameras and camera accessories.,26-05-2016 14:57,22-08-2018 18:16
134, Home Printer Shoppers, Consumers shopping for a printer.,26-05-2016 14:57,23-05-2018 11:30
135, Major Appliance Shoppers, Consumers shopping for major home appliances.,26-05-2016 14:57,23-05-2018 11:30
136, Tablet Researchers, Consumers reading reviews and comparing tablet devices.,26-05-2016 14:57,23-05-2018 16:19
137, Online Alcohol Shoppers, Consumers shopping for wine and liquor online.,26-05-2016 14:57,23-05-2018 11:30
138, Home Kitchen Bakers, Consumers researching home baking recipes.,26-05-2016 14:57,23-05-2018 11:30
139, Makeup Researchers, People reading about new beauty products.,26-05-2016 14:57,23-05-2018 11:30
140, Pet Owners, People shopping for pet food and researching pet wellness.,26-05-2016 14:57,23-05-2018 11:30
141, Skin Care Researchers, People reading about skin care techniques.,26-05-2016 14:57,23-05-2018 11:30
142, Credit Card Researchers, Consumers comparing credit card offers.,26-05-2016 14:57,23-05-2018 11:30
143, Health Insurance Researchers, Consumers researching healthcare options.,26-05-2016 14:57,23-05-2018 11:30
145, Property Insurance Researchers, Consumers researching property and homeowner insurance options.,26-05-2016 14:57,23-05-2018 11:30
146, Audio Equipment Researchers, Consumers reading reviews of high end stereo equipment.,26-05-2016 14:57,23-05-2018 11:30
147, Broadway Fans, People researching Broadway show reviews and shopping for tickets.,26-05-2016 14:57,23-05-2018 11:30
148, Celebrity Gossip Fans, Readers of online celebrity gossip websites.,26-05-2016 14:57,23-05-2018 11:30
149, Streaming Radio Listeners, Consumers listening to online streaming music services.,26-05-2016 14:57,23-05-2018 11:30
150, TV Junkies, Consumers researching TV listings.,26-05-2016 14:57,23-05-2018 11:30
151, Big & Tall Men, Consumers shopping for big and tall mens apparel.,26-05-2016 14:57,23-05-2018 11:30
153, Phone Accessory Shoppers, Consumers in-market for phone accessories.,26-05-2016 14:57,23-05-2018 11:30
154, Prepaid Smartphone Shoppers, Consumers in-market for a prepaid smartphone.,26-05-2016 14:57,23-05-2018 11:30
155, Business Travelers, Users of business travel planning and expense reimbursement tools.,26-05-2016 14:57,23-05-2018 11:30
157, Car Rental Shoppers, Consumers making online rental car bookings.,26-05-2016 14:57,23-05-2018 11:30
158, Flight and Hotel Shoppers, Consumers using online airfare comparison tools.,26-05-2016 14:57,23-05-2018 11:30
160, Sightseeing Travelers, Consumers reading online reviews of local attractions and tours.,26-05-2016 14:57,23-05-2018 11:30
161, Travel Reward Points Enthusiasts, Consumers comparing travel rewards programs.,26-05-2016 14:57,23-05-2018 11:30
162, Retirees, People using online retirement discount and health benefits services.,26-05-2016 14:57,23-05-2018 11:30
163, Federal Employees, People visiting government employee benefits websites.,26-05-2016 14:57,23-05-2018 11:30
164, Conservative News Readers, People reading right-leaning financial news websites.,26-05-2016 14:57,23-05-2018 11:30
165, Liberal News Readers, People reading left-leaning financial news websites.,26-05-2016 14:57,23-05-2018 11:30
166, Doves, People reading anti-war publications,26-05-2016 14:57,20-10-2017 11:11
168, Social Conservatives, People reading right-leaning social issues websites.,26-05-2016 14:57,23-05-2018 11:30
169, Social Liberals, People reading left-leaning social issues websites.,26-05-2016 14:57,23-05-2018 11:30
170, Voters, People researching voter registration options.,26-05-2016 14:57,23-05-2018 11:30
171, Shoe Shoppers, Consumers shopping for mass market shoes.,26-05-2016 14:57,23-05-2018 11:30
4847, Readers of Hispanic Content, People reading news from Hispanic media sources.,09-06-2016 16:28,23-05-2018 16:19
4848, Working Parents, People with young children researching daycare options.,09-06-2016 16:28,27-12-2017 12:31
4852, Health & Fitness, ,09-06-2016 16:28,28-03-2017 11:55
4855, Entertainment & Tabloid Magazine Readers, Avid readers of online content about the entertainment industry.,09-06-2016 16:28,07-12-2017 12:35
4857, Business Accounting Software Researchers, Professionals researching accounting software products.,09-06-2016 16:28,23-05-2018 11:30
4858, Business Filing Researchers, Professionals researching products and services to file a business.,09-06-2016 16:28,23-05-2018 11:30
4859, Business Logistics Managers, Professionals responsible for day-to-day business logistics.,09-06-2016 16:28,23-05-2018 11:30
4861, IT Decision Makers, Professionals researching and comparing IT solutions.,09-06-2016 16:28,23-05-2018 11:30
4866, Small Business Employees, ,09-06-2016 16:28,27-02-2018 14:07
4867, Sweepstakes Enthusiasts, Consumers visiting sweepstakes sites.,09-06-2016 16:28,23-05-2018 11:30
4869, Womens Fitness Enthusiasts, Consumers researching health and fitness trends and techniques for women.,09-06-2016 16:28,23-05-2018 11:30
4870, Tech-Savvy Moms, People reading tech sites geared to mothers.,09-06-2016 16:28,23-05-2018 11:30
4872, Readers of Mexican Content, People reading news from Mexican media sources.,09-06-2016 16:28,07-12-2018 11:59
4873, TV Game Show Fans, People searching for and watching TV game shows online.,09-06-2016 16:28,23-05-2018 16:19
4894, Credit Union Researchers, People researching and comparing credit unions for their financial needs.,11-08-2016 12:08,27-12-2017 12:31
4895, Mature Parents, Parents who had children later in life.,11-08-2016 12:12,23-05-2018 11:30
4896, Streaming Music Enthusiasts, People visiting sites that offer digital music streaming.,11-08-2016 12:12,23-05-2018 16:19
4897, Parents of Teenagers Going to College, People researching and comparing academic programs and college admission applications with their teenagers.,11-08-2016 12:12,27-12-2017 12:31
4898, Cosmetics and Beauty Shoppers, Consumers comparing and shopping for cosmetics and beauty products.,11-08-2016 12:12,27-12-2017 12:31
4899, Readers of Japanese Content, People reading news from Japanese media sources.,11-08-2016 12:13,23-05-2018 16:19
4902, Yogis, Active fans of yoga.,07-09-2016 16:12,23-05-2018 11:30
4903, Asthma Sufferers, People researching asthma trends and treatment options.,07-09-2016 16:12,23-05-2018 11:30
4904, Adult Acne Sufferers, People researching acne trends and treatment options.,07-09-2016 16:12,23-05-2018 11:30
4905, Heartburn Sufferers, People researching heartburn trends and treatment options.,07-09-2016 16:12,23-05-2018 11:30
4906, Sinus Researchers, People researching sinus condition trends and treatment options.,07-09-2016 16:12,23-05-2018 11:30
4907, Headache and Migraine Sufferers, People researching headache and migraine treatment options.,07-09-2016 16:12,23-05-2018 11:30
4908, Back Pain Sufferers, People researching back pain trends and treatment options.,07-09-2016 16:12,23-05-2018 11:30
4909, First Aid Researchers, People researching products and services related to first aid.,07-09-2016 16:12,23-05-2018 11:30
4910, Cholesterol Researchers, People researching cholesterol trends and treatment options.,07-09-2016 16:12,23-05-2018 11:30
4911, Dieters, Consumers reading content about diet and weight loss.,07-09-2016 16:12,23-05-2018 11:30
4912, Vitamin Shoppers, Consumers in-market for vitamins.,07-09-2016 16:12,23-05-2018 11:30
4913, Womens Health Researchers, People researching womens health options.,07-09-2016 16:12,23-05-2018 11:30
4914, Mens Health Researchers, People researching mens health options.,07-09-2016 16:12,23-05-2018 11:30
4915, Food Allergies Researchers, People researching food allergy treatment and alternative food options.,07-09-2016 16:12,23-05-2018 11:30
4916, Arthritis Sufferers, People researching arthritis trends and treatment options.,07-09-2016 16:12,23-05-2018 11:30
4917, Teen Content Readers, People reading sites featuring fashions for teens.,07-09-2016 16:12,23-05-2018 11:30
4918, Gastrointestinal Researchers, People researching gastrointestinal trends and treatment options.,07-09-2016 16:12,23-05-2018 11:30
4919, Military Families, People reading military publications.,07-09-2016 16:12,23-05-2018 11:30
4920, LGBT Activists, People visiting sites advocating LGBT rights.,07-09-2016 16:12,23-05-2018 11:30
4921, Tire Shoppers, Consumers in-market for vehicle tires.,07-09-2016 16:12,23-05-2018 11:30
4924, Surfers," People reading about surfing sites, techniques and equipment.",07-09-2016 16:12,16-01-2019 09:11
4925, Gun Control Advocates, People visiting sites advocating gun control.,07-09-2016 16:12,23-05-2018 11:30
4926, Gun Rights Advocates, People visiting sites advocating gun rights.,07-09-2016 16:12,23-05-2018 11:30
4927, Immigration Rights Advocates, People visiting sites advocating immigration rights.,07-09-2016 16:12,23-05-2018 11:30
4928, Immigration Control Advocates, People visiting sites advocating immigration control.,07-09-2016 16:12,23-05-2018 11:30
4929, Right Wing Radicals, The Oathkeepers movement.,07-09-2016 16:12,23-05-2018 11:30
4930, Occupy Movement Supporters, People who are interested in the Occupy movement.,07-09-2016 16:12,23-05-2018 11:30
4931, Marijuana Legalization Advocates, People visiting sites advocating the legalization of marijuana.,07-09-2016 16:12,23-05-2018 11:30
4932, Marijuana Prohibition Advocates, People visiting sites advocating the prohibition of marijuana.,07-09-2016 16:12,23-05-2018 11:30
4933, Family Values Advocates, People visiting sites advocating traditional family values.,07-09-2016 16:12,23-05-2018 11:30
4935, Conservative Think Tank Readers, People reading content online related to conservative think tanks.,07-09-2016 16:12,23-05-2018 11:30
4936, Liberal Think Tank Readers, People visiting sites related to liberal think tanks.,07-09-2016 16:12,23-05-2018 11:30
4937, Evangelical Christians, People engaged in Christian online forums.,07-09-2016 16:12,23-05-2018 11:30
4940, Auto-Looking for New Car Purchase or Lease, ,18-10-2016 11:50,07-09-2018 08:06
4943, Online Grocery Shoppers, Consumers purchasing groceries online.,28-10-2016 17:25,23-05-2018 11:30
4944, Pre-Measured Grocery Shoppers, Consumers purchasing groceries through a meal delivery service.,28-10-2016 17:25,23-05-2018 11:30
5895, Cardio Health Researchers, People reading news and advice on preventing and treating cardio health issues.,05-01-2017 17:02,27-12-2017 12:31
5896, Orthopedic Health Researchers, People reading news and advice on preventing and treating orthopedic health issues.,05-01-2017 17:02,27-12-2017 12:31
5897, Orthodontics Researchers, People researching and comparing orthodontic practices and treatments.,05-01-2017 17:02,27-12-2017 12:31
5898, Oncology Researchers, People reading news and advice on preventing and treating cancer.,05-01-2017 17:02,27-12-2017 12:31
5900, Dentures, ,27-01-2017 17:46,27-01-2017 17:46
5901, Diabetes, ,27-01-2017 17:46,27-01-2017 17:46
5904, Truck Drivers, Professionals reading industry news and researching products and services for truck driving and transportation.,16-02-2017 10:24,27-12-2017 16:31
5906, Business Communication Product Researchers, Professionals researching communication and productivity tools.,17-02-2017 12:17,23-05-2018 11:30
5907, Budget Small Business Researchers, Professionals researching budget-friendly options for small businesses.,17-02-2017 12:18,23-05-2018 11:30
5909, Web Design Researchers, Consumers researching creating websites and web design.,17-02-2017 15:23,23-05-2018 11:30
5910, SEO Specialists, Professionals specializing in search engine optimization strategies.,17-02-2017 15:23,23-05-2018 11:30
5911, Credit Score Researchers, People researching and using services to check their credit.,17-02-2017 15:25,27-12-2017 12:31
5913, Spa Goers, Consumers comparing spas and booking appointments online.,17-02-2017 15:42,26-08-2019 11:24
5914, Career Focused Individuals, People researching career development and advancement.,17-02-2017 15:54,23-05-2018 11:30
5916, Shared Work Space Researchers, People researching locations for shared work spaces.,17-02-2017 15:56,07-12-2017 12:35
5917, Caribbean Trip Planners, People researching attractions and accommodations in the Caribbean islands. These consumers are more likely to spend money on travel and local attractions.,17-02-2017 15:57,07-12-2017 12:35
5918, Enterprise Field Services Researchers, Professionals reading industry news on enterprise field services.,17-02-2017 15:58,23-05-2018 11:30
