Column1.1,Column1.2,Column1.3,Column1.4,Column1.5
6323, New Orleans Trip Planners," People researching attractions and accommodations in New Orleans. These consumers are more likely to spend money on flights, hotels, and local attractions.",10-05-2017 16:13,07-12-2017 12:35
6324, Las Vegas Trip Planners," People researching attractions and accommodations in Las Vegas. These consumers are more likely to spend money on flights, hotels, and local attractions.",10-05-2017 16:13,07-12-2017 12:35
6325, Orlando Trip Planners," People researching attractions and accommodations in Orlando. These consumers are more likely to spend money on flights, hotels, and local attractions.",10-05-2017 16:13,07-12-2017 12:35
6328, Mattress Researchers, ,15-05-2017 13:03,15-05-2017 13:03
6329, Mattress Shoppers, Consumers considering purchasing a mattress.,15-05-2017 13:04,23-05-2018 11:30
6330, Pet Store Goers, ,15-05-2017 13:04,15-05-2017 13:04
6331, Price Conscious Grocery Shoppers, Consumers seeking good deals on groceries.,15-05-2017 13:04,23-05-2018 11:30
6332, Tire Researchers, ,15-05-2017 13:04,15-05-2017 13:04
6333, Crafting Enthusiasts, People looking for crafting inspiration and purchasing equipment.,15-05-2017 13:04,23-05-2018 11:30
6334, Supermarket Shoppers, Consumers shopping for groceries at major supermarkets.,15-05-2017 13:04,23-05-2018 11:30
6335, Outdoors Enthusiasts, People reading outdoor activities news and destinations.,15-05-2017 13:04,23-05-2018 11:30
6336, Mid-Range Grocery Shoppers, Consumers shopping for groceries at mid-range grocery stores.,15-05-2017 13:04,23-05-2018 11:30
6337, Diner and Ice Cream Lovers, Consumers who often frequent diners and ice cream shops.,15-05-2017 13:04,23-05-2018 11:30
6339, Eyeglasses Wearers, ,15-05-2017 13:04,15-05-2017 13:04
6340, Kitchen and Home Goods Shoppers, Consumers comparing or purchasing home and kitchen decor and furniture.,15-05-2017 13:04,07-12-2017 12:35
6341, Pharmacy Shoppers, Consumers researching and purchasing pharmaceuticals online.,15-05-2017 13:04,23-05-2018 11:30
6343, Patio Furniture Shoppers, Consumers comparing or purchasing patio furniture.,15-05-2017 13:04,07-12-2017 12:35
6344, Hair Care Shoppers, Consumers researching trends and purchasing hair and beauty products.,15-05-2017 13:04,31-05-2018 22:11
6345, Senior Caregivers, Professionals reading healthcare industry news focused on senior citizens.,15-05-2017 13:04,23-05-2018 11:30
6363, Readers of Caribbean Content, People reading news from Caribbean media sources.,23-05-2017 16:28,23-05-2018 16:19
6364, Pizza Lovers, ,23-05-2017 18:19,23-05-2017 18:19
6365, Executive and C-Suite, People identified as holding executive positions as companies .,23-05-2017 18:19,07-09-2018 08:06
6366, Rideshare App Users, People that regularly use rideshare apps for travel,23-05-2017 18:19,20-08-2019 11:34
6367, Cable TV Shoppers, Consumers researching cable TV packages.,23-05-2017 18:19,23-05-2018 11:30
6378, Luggage Shoppers, Consumers in-market for new luggage.,31-05-2017 16:26,23-05-2018 11:30
6385, Motorcycle Purchasers, ,08-06-2017 12:21,08-06-2017 12:21
6386, Powerboat Purchasers, ,08-06-2017 12:21,08-06-2017 12:21
6387, Wireless Service Provider Researchers, ,08-06-2017 12:21,08-06-2017 12:21
6389, Oil Change Customers, ,08-06-2017 12:21,08-06-2017 12:21
6390, Pool and Spa Researchers, ,08-06-2017 12:21,07-09-2018 08:07
6391, HVAC Service Researchers, ,08-06-2017 12:21,08-06-2017 12:21
6393, Eye Health Researchers, People researching eye health and symptoms.,08-06-2017 12:21,23-05-2018 11:30
7425, Life Insurance Researchers, People researching and comparing life insurance policies. These consumers are more likely to spend money with insurance companies.,15-06-2017 17:44,27-12-2017 12:31
7453, Pilots, Professionals reading industry news and researching products and services for pilots.,27-06-2017 17:12,27-12-2017 12:31
7454, Farmers, Professionals reading industry news and researching products and services for farmers.,27-06-2017 17:12,27-12-2017 12:31
7461, Food Industry Professionals, Professionals reading industry news and researching products and services for food safety.,28-06-2017 13:17,23-05-2018 16:19
7464, Guitar Enthusiasts, People reading guitar news and shopping for new equipment.,29-06-2017 11:17,23-05-2018 11:30
7483, Economy Grocery Shoppers, ,06-07-2017 15:45,06-07-2017 15:45
7527, Democratic Donors, ,17-07-2017 17:24,17-07-2017 17:24
7529, Foreman and Construction Managers, Professionals reading foreman and construction industry news.,17-07-2017 17:25,23-05-2018 16:19
7534, Canada Trip Planners, People researching attractions and accommodations in Canada. These consumers are more likely to spend money on travel and local attractions.,18-07-2017 16:24,27-12-2017 12:31
7535, Medicare Provider Researchers, People researching Medicare providers and options.,18-07-2017 16:24,23-05-2018 11:30
7536, Medicare Price Shoppers, People comparing Medicare providers based on price.,18-07-2017 16:24,23-05-2018 11:30
7537, Ecommerce Platform Researchers, People comparing products and services of ecommerce platforms.,18-07-2017 16:24,23-05-2018 16:19
7540, North Carolina Travel Researchers, People researching attractions and accommodations in North Carolina.,19-07-2017 11:24,23-05-2018 11:30
7541, Alabama Trip Planners," People researching attractions and accommodations in Alabama. These consumers are more likely to spend money on flights, hotels, and local attractions.",19-07-2017 11:24,07-12-2017 12:35
7542, Georgia Trip Planners," People researching attractions and accommodations in Georgia. These consumers are more likely to spend money on flights, hotels, and local attractions.",19-07-2017 11:24,07-12-2017 12:35
7543, Louisiana Trip Planners," People researching attractions and accommodations in Louisiana. These consumers are more likely to spend money on flights, hotels, and local attractions.",19-07-2017 11:24,07-12-2017 12:35
7544, Texas Trip Planners," People researching attractions and accommodations in Texas. These consumers are more likely to spend money on flights, hotels, and local attractions.",19-07-2017 11:24,07-12-2017 12:35
7545, Florida Atlantic Coast Trip Planners," People researching attractions and accommodations in Florida. These consumers are more likely to spend money on flights, hotels, and local attractions.",19-07-2017 11:24,07-12-2017 12:35
7546, Florida Gulf Coast Travel Researchers, People researching attractions and accommodations in the Florida Gulf Coast area.,19-07-2017 11:24,23-05-2018 11:30
7557, Tailgaters, ,20-07-2017 17:31,16-01-2019 09:11
7597, Readers of Spanish Content, People reading news from Spanish media sources.,02-08-2017 11:30,23-05-2018 16:19
7598, Readers of South American Content, People reading news from South American media sources.,02-08-2017 11:30,23-05-2018 16:19
7605, Organic Food Buyers, ,07-08-2017 10:00,07-08-2017 10:00
7685, Home Healthcare Researchers, People researching and comparing products and services for home healthcare.,24-08-2017 15:42,27-12-2017 12:31
10007, Mobile Phone Purchase Intenders, Consumers in-market for a mobile phone.,12-09-2017 16:34,23-05-2018 11:30
10008, Japanese Luxury Car Enthusiasts, Consumers reading content about luxury cars from Japan.,12-09-2017 16:39,23-05-2018 11:30
10009, Investment Services Intenders, People researching and comparing investment service providers for personal investments.,12-09-2017 16:39,05-03-2018 11:41
10010, Satellite TV Buyers, Consumers in-market for satellite television.,12-09-2017 16:39,23-05-2018 11:30
10011, Big Box Shoppers, Consumers who shop at big box retailers.,12-09-2017 16:39,23-05-2018 11:30
10249, Loan Comparison Researchers, Consumers researching and comparing loan offerings from different financial institutions.,15-09-2017 16:53,07-12-2017 12:35
12032, Heart Health Researchers, People reading news and advice on preventing and treating heart health issues.,16-11-2017 14:20,27-12-2017 12:31
10250, Halloween Costume Shoppers, Consumers comparing and shopping for Halloween costumes. These consumers are more likely to spend money on costumes for themselves and their kids.,15-09-2017 16:53,27-12-2017 12:31
10251, Personal Bank Comparison Researchers, Consumers researching and comparing personal checking and saving account products from different banks.,18-09-2017 15:07,07-12-2017 12:35
10284, Alaskan Cruise Planners, People researching cruise accommodations for trips to Alaska. These consumers are more likely to spend money on travel and local attractions.,20-09-2017 11:40,27-12-2017 12:31
10326, IT News Readers, People reading industry news and product releases for information technology.,21-09-2017 16:35,27-12-2017 12:31
10351, Military Personal Finance Researchers, People researching personal finance while also demonstrating interest in military related content.,25-09-2017 16:08,23-05-2018 11:30
10364, Documentary Film Fans, People who love watching and reading about documentary films .,26-09-2017 18:05,23-05-2018 11:30
10365, Horror Movie Fans, People interested in watching and reading about horror films .,26-09-2017 18:05,23-05-2018 11:30
10366, Sci-Fi Movie Fans, People who love watching and reading articles about Sci-fi movies.,26-09-2017 18:05,23-05-2018 11:30
10832, Austin Trip Planners," People researching attractions and accommodations in Austin. These consumers are more likely to spend money on flights, hotels, and local attractions.",11-10-2017 11:16,07-12-2017 12:35
10833, Dallas Trip Planners," People researching attractions and accommodations in Dallas. These consumers are more likely to spend money on flights, hotels, and local attractions.",11-10-2017 11:16,07-12-2017 12:35
10834, Norfolk and Virginia Beach Trip Planners," People researching attractions and accommodations in Norfolk and Virginia. These consumers are more likely to spend money on flights, hotels, and local attractions.",11-10-2017 11:16,07-09-2018 08:07
10835, Long Beach California Trip Planners," People researching attractions and accommodations in Long Beach, California. These consumers are more likely to spend money on flights, hotels, and local attractions.",11-10-2017 11:16,07-12-2017 12:35
10836, Fort Lauderdale Trip Planners," People researching attractions and accommodations in Fort Lauderdale. These consumers are more likely to spend money on flights, hotels, and local attractions.",11-10-2017 11:16,07-12-2017 12:35
10837, Denver Trip Planners," People researching attractions and accommodations in Denver. These consumers are more likely to spend money on flights, hotels, and local attractions.",11-10-2017 11:16,07-12-2017 12:35
10838, Detroit Trip Planners," People researching attractions and accommodations in Detroit. These consumers are more likely to spend money on flights, hotels, and local attractions.",11-10-2017 11:16,07-12-2017 12:35
10839, Tampa and St Petersburg Trip Planners," People researching attractions and accommodations in Tampa and St Petersburg. These consumers are more likely to spend money on flights, hotels, and local attractions.",11-10-2017 11:16,07-09-2018 08:07
10869, Seattle Seahawks Fans, People reading news about the Seattle Seahawks and watching games. These consumers are more likely to spend money on team gear.,16-10-2017 10:18,27-12-2017 12:31
10870, Philadelphia Eagles Fans, People reading news about the Philadelphia Eagles and watching games. These consumers are more likely to spend money on team gear.,16-10-2017 10:18,27-12-2017 12:31
10871, Dallas Cowboys Fans, People reading news about the Dallas Cowboys and watching games. These consumers are more likely to spend money on team gear.,16-10-2017 10:18,27-12-2017 12:31
10872, Atlanta Falcons Fans, People reading news about the Atlanta Falcons and watching games. These consumers are more likely to spend money on team gear.,16-10-2017 10:18,27-12-2017 12:31
10953, Beard Care Shoppers, Consumers comparing and shopping for beard care products and services.,23-10-2017 12:32,27-12-2017 12:31
10954, Nintendo Enthusiasts, People who love visiting video game websites and reading about Nintendo.,23-10-2017 12:32,23-05-2018 11:30
10955, Pokemon Enthusiasts, People who love visiting video game websites and reading about Pokemon.,23-10-2017 12:32,23-05-2018 11:30
10970, Halloween Decorations Shoppers, Consumers in-market for Halloween decorations.,24-10-2017 10:16,23-05-2018 11:30
10971, Halloween Enthusiasts, People who visit Halloween related websites.,24-10-2017 10:16,23-05-2018 11:30
10972, Halloween Thrill Seekers, People researching Halloween related thrill venues and ideas.,24-10-2017 10:16,23-05-2018 11:30
10973, Family Halloween Party Planners, Consumers in-market for Halloween party supplies and content.,24-10-2017 10:16,23-05-2018 11:30
10974, Thanksgiving Entertaining Researchers, Consumers reading online about Thanksgiving entertaining ideas.,24-10-2017 10:16,23-05-2018 11:30
10975, Thanksgiving Meal Planners, People reading online about Thanksgiving meal ideas.,24-10-2017 10:16,23-05-2018 11:30
10976, Christmas Decorations Shoppers, Consumers in-market for Christmas decorations.,24-10-2017 10:16,23-05-2018 11:30
10977, Christmas Celebration Researchers, People reading online about Christmas celebration ideas.,24-10-2017 10:16,23-05-2018 11:30
10978, Family Christmas Celebration Researchers, People reading online about family focused Christmas celebration ideas.,24-10-2017 10:16,23-05-2018 11:30
10979, Hanukkah Celebration Planners, People researching online about Hanukkah Celebration ideas.,24-10-2017 10:16,23-05-2018 11:30
10980, Hanukkah Decorations Shoppers, Consumers in-market for Hanukkah decorations.,24-10-2017 10:16,23-05-2018 11:30
10981, New Years Eve Party Ticket Purchasers, Consumers in-market for New Years Eve party tickets.,24-10-2017 10:16,23-05-2018 11:30
10988, Santa Monica Trip Planners," People researching attractions and accommodations in Santa Monica. These consumers are more likely to spend money on flights, hotels, and local attractions.",25-10-2017 12:42,07-12-2017 12:35
11065, Authors, Professionals reading industry news and researching products and services for professional writing.,01-11-2017 10:42,27-12-2017 12:31
11066, Chain Pizzeria Fans, Consumers researching promotions and ordering pizza from online pizza chains.,01-11-2017 10:42,31-05-2018 22:11
11067, NCAA Football Fans, People reading articles and websites about college football and the NCAA.,01-11-2017 10:42,23-05-2018 11:30
11974, Price Conscious Home Shoppers, Consumers shopping for discount home furnishings,13-11-2017 15:15,26-02-2018 15:39
11975, Landscape Architects, Professionals reading industry news and researching products and services for landscape design.,13-11-2017 15:15,27-12-2017 12:31
11977, Civil Engineers, Professionals reading industry news and researching products and services for civil engineering.,13-11-2017 15:15,27-12-2017 12:31
12025, Urban Skateboarding Sneaker Shoppers, Consumers comparing and shopping for trendy urban skateboarding sneakers.,16-11-2017 14:05,27-12-2017 12:31
12026, California Trip Planners," People researching attractions and accommodations in California. These consumers are more likely to spend money on flights, hotels, and local attractions.",16-11-2017 14:05,07-12-2017 12:35
12027, Gen Z Apparel Shoppers, Consumers comparing and shopping for clothing and accessories popular with Gen Z.,16-11-2017 14:05,27-12-2017 12:31
12031, Neurologists, Professionals reading industry news and researching products and services for neurology.,16-11-2017 14:20,27-12-2017 12:31
12132, Last Minute Travelers, People researching and booking travel accommodations with little to no advanced notice.,27-11-2017 16:45,27-12-2017 12:31
12133, Luxury Boutique Hotel Researchers," Consumers comparing or purchasing accommodations at luxury, boutique hotels.",27-11-2017 16:45,07-12-2017 12:35
12277, Market Intelligence Researchers, Professionals reading industry news focused on market intelligence.,04-12-2017 17:10,18-12-2017 10:57
12490, Gourmet Food Purchasers, Consumers shopping for gourmet food products and services.,14-12-2017 15:05,26-02-2018 15:40
12602, Family Medical Practice Journal Researchers, People reading news about the Catholic faith.,18-12-2017 12:10,07-12-2018 11:59
12820, Commercial Contractors & Designers, Professionals reading industry news about contracting and designing for commercial properties.,21-12-2017 12:30,07-12-2018 11:59
12821, Commercial Healthcare Hospitality & Retail Designers, Professionals reading industry news about hospitality and retail design for commercial healthcare properties.,21-12-2017 12:30,07-12-2018 11:59
13421, Los Angeles Mass Transit Commuters, People reading news about mass transit systems in Los Angeles and using commuter resources.,04-01-2018 10:25,04-01-2018 10:25
13428, Smoking Cessation Intenders, People researching available products and services to stop smoking cigarettes.,04-01-2018 17:30,23-05-2018 16:19
13496, Professional Chefs, Professionals reading industry news and researching products and services for chefs.,08-01-2018 16:15,23-05-2018 16:19
13497, Restaurant Supply Shoppers, Consumers comparing and shopping for wholesale restaurant food and supplies.,08-01-2018 16:15,23-05-2018 16:19
13498, Restaurant News Readers, Professionals reading industry news and researching products and services for restaurants.,08-01-2018 16:15,23-05-2018 16:19
14800, Rapid City Trip Planners," People researching attractions and accommodations in Rapid City. These consumers are more likely to spend money on flights, hotels, and local attractions.",24-01-2018 18:25,23-05-2018 16:19
14801, Cryptocurrency Enthusiasts, People reading industry news and following trends on cryptocurrencies.,24-01-2018 18:25,24-01-2018 18:25
14802, Online Bank Researchers, People researching online banks and comparing products and services.,24-01-2018 18:30,23-05-2018 16:19
14895, In-Market Car Shoppers, Consumers shopping for cars on car consolidator search sites.,26-01-2018 15:40,12-03-2018 16:42
14901, Audio Book Listeners, People visiting sites to download audio books and audio content.,26-01-2018 16:20,23-05-2018 16:19
15877, Readers of Pakistani Content, People reading news from Pakistani media sources.,02-02-2018 16:25,23-05-2018 16:19
15878, Readers of Catholic News, People reading news about the Muslim faith.,02-02-2018 16:25,07-12-2018 11:59
15879, Freelancers, Professionals reading industry news and following trends on freelancing.,02-02-2018 16:25,02-02-2018 16:25
15882, Online Role Playing Game Enthusiasts, People researching role playing games and sharing with the community.,02-02-2018 16:25,07-12-2018 11:59
15883, Video and Computer Gaming Enthusiasts, People reading news and following gaming trends.,02-02-2018 16:25,07-12-2018 11:59
15884, Video Gamers, People researching and reading reviews of video games.,02-02-2018 16:25,07-12-2018 11:59
15935, Pregnancy Resources Researchers, People who visit websites and read articles related to pregnancy and childbirth.,06-02-2018 11:45,31-05-2018 22:11
16119, San Diego Trip Planners," People researching attractions and accommodations in San Diego. These consumers are more likely to spend money on flights, hotels, and local attractions.",13-02-2018 10:50,13-02-2018 10:50
16137, Olympics Fans, People reading news about the Olympics and following the events.,13-02-2018 14:10,13-02-2018 14:10
16138, Special Olympics Fans, People reading news about the Special Olympics and following the events.,13-02-2018 14:10,13-02-2018 14:10
16196, Mexico Trip Planners," People researching attractions and accommodations in Mexico. These consumers are more likely to spend money on flights, hotels, and local attractions.",14-02-2018 15:50,14-02-2018 15:50
16197, Financial Business Intelligence Researchers, Professionals reading industry news and following financial business intelligence trends.,14-02-2018 15:50,22-02-2018 15:26
16198, World of Warcraft Enthusiasts, People researching World of Warcraft news and following gaming trends.,14-02-2018 15:50,12-12-2018 18:21
17269, At-Home Gym Intenders, Consumers purchasing products and services for exercising at home.,27-02-2018 14:15,23-05-2018 16:19
17271, Car Collector Enthusiasts, People reading news on the collector car market. ,27-02-2018 14:15,23-05-2018 16:19
17274, Readers of Jamaican Content, People reading news from Jamaican media sources.,27-02-2018 14:15,23-05-2018 16:19
17314, Lobbyists, Professionals reading industry news on lobbying.,28-02-2018 11:00,07-12-2018 11:59
17318, Charitable Organization Supporters, People supporting charitable organizations through service and donations.,28-02-2018 11:00,07-12-2018 11:59
17320, March Madness Enthusiasts, People watching college basketball and reading about March Madness.,28-02-2018 11:00,28-02-2018 11:00
17452, Clinic & Lab Immunologist Professionals, Professionals reading industry news and trends on immunology at medical clinics and labs. ,01-03-2018 16:10,23-05-2018 16:19
17540, Vacuum Shoppers, People comparing and shopping for vacuums and vacuum parts.,06-03-2018 16:20,06-03-2018 16:20
17669, Fragrance Shoppers, People shopping for perfume or cologne.,09-03-2018 14:20,09-03-2018 14:20
17670, Deodorant Shoppers, People shopping for deoderant.,09-03-2018 14:20,09-03-2018 14:20
17671, Crypto Market Investors, People researching news and trends on the crypto market.,09-03-2018 14:20,09-03-2018 14:20
17672, Indie Coffee Shoppers, People shopping for coffee products from independent coffee brands.,09-03-2018 14:20,23-05-2018 16:19
17673, Coffee Chain Shoppers, People shopping for coffee products from chains coffee brands.,09-03-2018 14:20,23-05-2018 16:19
17674, Medical Advice Researchers, People researching medical symptoms and seeking advice online.,09-03-2018 14:20,07-12-2018 11:59
17729, Competitive Car Brand Shoppers, People comparing and shopping for competitive economy car brands.,12-03-2018 15:35,23-05-2018 11:30
17730, Luxury Department Store Shoppers, Consumers shopping at luxury department stores.,12-03-2018 15:35,07-12-2018 11:59
17785, Luxury Womens Brands Shoppers, Consumers shopping for clothing and accessories from luxury womens brands.,14-03-2018 11:00,07-12-2018 11:59
17786, Womens Fashion Brands Shoppers, Consumers shopping for clothing and accessories from top womens fashion brands.,14-03-2018 11:00,07-12-2018 11:59
17803, TV Advertising Professionals, Professionals reading industry news and following trends for tv advertising.,14-03-2018 13:35,11-04-2018 16:46
18202, Real Estate Decision Makers, Professionals reading industry news and trends on real estate.,21-03-2018 13:30,07-12-2018 11:59
18203, Hunters, Consumers reading hunting news and shopping for products and equipment for hunting.,21-03-2018 13:30,07-12-2018 11:59
18204, Healthcare Thought Leaders, Professionals reading industry news and sharing information on healthcare.,21-03-2018 13:30,31-05-2018 22:11
18347, Affordable Hotel Bookers, Consumers comparing and booking hotel accommodations at affordable level US hotel chains.,26-03-2018 16:20,26-03-2018 16:20
18348, Sci-Fi Show Watchers, Consumers watching and reading about popular sci-fi television shows.,26-03-2018 16:20,23-05-2018 11:30
18350, Photo Memory Makers, Consumers comparing services and shopping for prodcuts to make creations out of their photographs.,26-03-2018 16:45,26-03-2018 16:45
18351, Drama Show Watchers, Consumers watching and reading about popular drama television shows.,26-03-2018 16:45,26-03-2018 16:45
18352, Pediatric Provider Researchers, People researching healthcare providers and doctors for pedriatric medicine.,26-03-2018 16:45,12-12-2018 17:00
18490, Professional Sound Products Researchers, People researching and shopping for professional sound products.,30-03-2018 16:25,30-03-2018 16:25
18619, Asian Food Enthusiasts, People reading about Asian food and researching recipes.,09-04-2018 12:10,09-04-2018 12:10
18620, Mexican Food Enthusiasts, People reading about Mexican food and researching recipes.,09-04-2018 12:10,23-05-2018 11:30
18621, Italian Food Enthusiasts, People reading about Italian food and researching recipes.,09-04-2018 12:10,09-04-2018 12:10
18622, Las Vegas Nightlife Researchers, People researching nightlife in Las Vegas.,09-04-2018 12:10,09-04-2018 12:10
18646, Recipe Researchers, People researching recipes for at home cooking and entertaining.,10-04-2018 14:55,10-04-2018 14:55
18647, Gourmet Food & Wine Researchers, People researching recipes and trends for gourmet food and wine.,10-04-2018 14:55,10-04-2018 14:55
18648, Architecture Enthusiasts, People reading industry news and following architecture trends.,10-04-2018 14:55,10-04-2018 14:55
18781, Gastroenterology Journal Researchers, People and medical professionals reading gastroenterology journals.,16-04-2018 16:00,04-05-2018 15:11
18782, Internal Medicine Journal Researchers, People and medical professionals reading internal medicine journals.,16-04-2018 16:00,04-05-2018 15:11
18783, Nursing and Physicians Assistant Journal Researchers, People and medical professionals reading nursing and physicians assistant journals.,16-04-2018 16:00,04-05-2018 15:11
18784, Healthcare Provider Education Researchers, People and medical professionals reading family medical practice journals. ,16-04-2018 16:00,23-05-2018 16:19
18807, Food Safety QA Professionals, Professionals reading food safety industry news.,17-04-2018 11:25,23-05-2018 16:19
18923, Online Home Decor Shoppers, Consumers shopping online for home decor available for delivery.,19-04-2018 18:25,19-04-2018 18:25
18924, Commercial Banking Market Intelligence Researchers, Professionals researching market intelligence for commercial banking.,19-04-2018 18:25,19-04-2018 18:25
18995, Commercial Architects and Designers, Professionals reading industry news on commercial architecture and design.,23-04-2018 15:55,23-04-2018 15:55
